{
  "schema_version": "1.0",
  "opportunity_id": "11111111-1111-4111-8111-111111111111",
  "document_id": "22222222-2222-4222-8222-222222222222",
  "latest_approved_version_id": null,
  "status": "ready",
  "generated_at": "2026-10-05T08:00:00Z",
  "intake_context": {
    "client_name": "Northwind",
    "contact_name": "Ada Lovelace",
    "website_url": "https://northwind.example",
    "meeting_purpose": "Warehouse slotting review",
    "meeting_purpose_source": "sales_topic_description",
    "additional_information": "Family-owned distributor in Hamburg."
  },
  "pages": [
    {
      "key": "cover",
      "order": 1,
      "title": "Cover",
      "status": "ready",
      "content": {
        "client_name": "Northwind",
        "document_title": "Discovery Paper",
        "meeting_purpose": "Warehouse slotting review",
        "contact_name": "Ada Lovelace",
        "website_url": "https://northwind.example",
        "origin": "USER_INPUT"
      }
    },
    {
      "key": "client_context",
      "order": 2,
      "title": "Client context",
      "status": "ready",
      "content": {
        "summary": "Client context uses only stored intake and verified research. Unknown company facts are listed and not filled in.",
        "known_facts": [
          {
            "label": "Company Name",
            "value": "Northwind",
            "origin": "USER_INPUT"
          },
          {
            "label": "Contact Person",
            "value": "Ada Lovelace",
            "origin": "USER_INPUT"
          },
          {
            "label": "Website URL",
            "value": "https://northwind.example",
            "origin": "USER_INPUT"
          },
          {
            "label": "Additional Information",
            "value": "Family-owned distributor in Hamburg.",
            "origin": "USER_INPUT"
          }
        ],
        "unknowns": [
          "description",
          "headquarters",
          "employee_headcount",
          "decision_makers",
          "revenue"
        ],
        "additional_information": "Family-owned distributor in Hamburg."
      }
    },
    {
      "key": "opportunity",
      "order": 3,
      "title": "Opportunity",
      "status": "ready",
      "content": {
        "meeting_purpose": "Warehouse slotting review",
        "meeting_purpose_source": "sales_topic_description",
        "statement": "Meeting purpose: Warehouse slotting review Additional information: Family-owned distributor in Hamburg.",
        "origin": "USER_INPUT"
      }
    },
    {
      "key": "borek_approach",
      "order": 4,
      "title": "Borek approach",
      "status": "ready",
      "content": {
        "availability": "unknown",
        "title": null,
        "statement": null,
        "origin": "UNKNOWN",
        "source_refs": []
      }
    },
    {
      "key": "relevant_use_case",
      "order": 5,
      "title": "Relevant use case",
      "status": "ready",
      "content": {
        "availability": "unknown",
        "title": null,
        "statement": null,
        "origin": "UNKNOWN",
        "source_refs": []
      }
    },
    {
      "key": "pilot_proposal",
      "order": 6,
      "title": "Pilot proposal",
      "status": "ready",
      "content": {
        "concept": "A discovery pilot would explore Warehouse slotting review with Northwind. Duration and commercial terms are not included.",
        "commercial_terms": "not_included",
        "origin": "GROUNDED_TEMPLATE"
      }
    },
    {
      "key": "next_steps",
      "order": 7,
      "title": "Next steps",
      "status": "ready",
      "content": {
        "items": [
          {
            "order": 1,
            "label": "Confirm Warehouse slotting review with Ada Lovelace before the first meeting.",
            "origin": "GROUNDED_TEMPLATE"
          },
          {
            "order": 2,
            "label": "Review only company facts that are marked verified.",
            "origin": "GROUNDED_TEMPLATE"
          },
          {
            "order": 3,
            "label": "Use the first meeting to collect missing context. This paper is not a commitment.",
            "origin": "GROUNDED_TEMPLATE"
          }
        ]
      }
    }
  ]
}
